[
  {
    "id": "gc-connaissances",
    "label": "Solidité des connaissances",
    "aide": "Mes définitions, formules et résultats étaient-ils justes et précis, sans approximation ?",
    "order": 0,
    "sources": ["s-grand-oral"]
  },
  {
    "id": "gc-argumentation",
    "label": "Capacité à argumenter et à relier les savoirs",
    "aide": "Mes arguments s'enchaînaient-ils vers une réponse ? Ai-je relié mes deux spécialités, ou d'autres savoirs ?",
    "order": 1,
    "sources": ["s-grand-oral"]
  },
  {
    "id": "gc-esprit-critique",
    "label": "Esprit critique",
    "aide": "Ai-je dit les limites de ma réponse, les hypothèses d'un modèle, ce qui reste incertain ?",
    "order": 2,
    "sources": ["s-grand-oral"]
  },
  {
    "id": "gc-precision",
    "label": "Précision de l'expression",
    "aide": "Ai-je employé le mot exact (« proportionnel », « tend vers », « énergie »…) plutôt qu'un à-peu-près ?",
    "order": 3,
    "sources": ["s-grand-oral"]
  },
  {
    "id": "gc-clarte",
    "label": "Clarté du propos",
    "aide": "Quelqu'un qui ne fait ni maths ni physique aurait-il suivi mon plan et compris ma réponse ?",
    "order": 4,
    "sources": ["s-grand-oral"]
  },
  {
    "id": "gc-engagement",
    "label": "Engagement dans sa parole",
    "aide": "Ai-je parlé sans réciter, en regardant le jury, avec une voix posée et audible ?",
    "order": 5,
    "sources": ["s-grand-oral"]
  },
  {
    "id": "gc-conviction",
    "label": "Force de conviction",
    "aide": "Ma réponse à la question était-elle nette et assumée, y compris face aux objections ?",
    "order": 6,
    "sources": ["s-grand-oral"]
  }
]
